line number,Character,Character pinyin,Character EN translation,Character HE translation ,Related Sentence,Sentence Pinyin,Sentence EN Translation,Sentence HE Translation,Apearances in sentences,Group,Sentence Length
1483,文房四宝,wénfángsìbǎo,4 treasures of study,4 אוצרות לימוד,文房四宝齐全,wénfáng sìbǎo qíquán,Complete set of four treasures of the study,סט שלם של ארבעה אוצרות של המחקר,4,Group 2,6
1484,靠,kào,rely on.,להסתמך על.,我靠自己学习,wǒ kào zì jǐ xué xí,I learn on my own,אני לומד לבד,3,Group 2,6
1485,闻,wén,smell.,רֵיחַ.,我闻见了花香,wǒ wén jiàn liǎo huā xiāng,I smell the fragrance of flowers,אני מריח ניחוח של פרחים,3,Group 2,6
1486,污染,wūrǎn,pollute;,לְזַהֵם;,工厂污染环境,gōngchǎng wūrǎn huánjìng,Factories pollute the environment,מפעלים מזהמים את הסביבה,2,Group 2,6
1487,母亲,mǔqin,mother.,אִמָא.,向你母亲问好,xiàng nǐ mǔ qīn wèn hǎo,Say hello to your mother,תגיד שלום לאמא שלך,2,Group 2,6
1488,热闹,rènào,lively;,מָלֵא חַיִים;,街上热闹着呢,jiē shàng rè nào zhuó ne,The streets are bustling.,הרחובות הומים.,2,Group 2,6
1489,颜色,yánshai,colour,צֶבַע,另外的颜色？,lìng wài de yán sè ？,Another color?,צבע אחר?,2,Group 2,6
1490,要求,yāoqiú,demand; require; requirement,לִדרוֹשׁ; לִדרוֹשׁ; דְרִישָׁה,我有一个要求,wǒ yǒu yī gè yào qiú,I have a request,יש לי בקשה,2,Group 2,6
1491,铁路,tiělù,railway;,רכבת;,这条铁路很长。,Zhè tiáo tiělù hěn cháng.,This railway is very long.,מסילת הברזל הזו ארוכה מאוד.,4,Group 2,7
1492,另外,lìngwài,"other, besides.","אחר, חוץ מזה.",另外还有什么？,Lìngwài hái yǒu shénme?,What else?,מה עוד?,2,Group 2,7
1493,工业,gōngyè,industry.,תַעֲשִׂיָה.,工业发展很快。,Gōngyè fāzhǎn hěn kuài.,The industry is developing rapidly.,התעשייה מתפתחת במהירות.,4,Group 2,7
1494,影响,yǐngxiǎng,influence;,לְהַשְׁפִּיעַ;,这会影响健康。,Zhè huì yǐngxiǎng jiànkāng.,This can affect your health.,זה יכול להשפיע על הבריאות שלך.,4,Group 2,7
1495,感情,gǎnqíng,emotion; feeling;,רֶגֶשׁ; מַרגִישׁ;,我们感情很好。,Wǒmen gǎnqíng hěn hǎo.,We have a good relationship.,יש לנו מערכת יחסים טובה.,4,Group 2,7
1496,冰箱,bīngxiāng,refrigerator; freezer.,מְקָרֵר; מַקפִּיא.,冰箱里有食物。,Bīngxiāng lǐ yǒu shíwù.,There is food in the refrigerator.,יש אוכל במקרר.,4,Group 2,7
1497,好看,hǎokàn,interesting;,מעניין;,这本书很好看。,Zhè běn shū hěn hǎokàn.,This book is very good.,הספר הזה טוב מאוד.,2,Group 2,7
1498,编,biān,"write, compose.","לכתוב, להלחין.",编一部英汉词典,biān yī bù yīng hàn cí diǎn,Compile an English-Chinese dictionary,ערכו מילון אנגלי-סיני,4,Group 2,7
1499,出去,chúqu,go out;,לָצֵאת;,我要出去一会儿,wǒ yào chū qù yī huì ér,I'm going out for a while,אני יוצא לזמן מה,4,Group 2,7
1500,女儿,nǚ'ér,daughter;,בַּת;,你能帮我和女儿,nǐ néng bāng wǒ hé nǚ ér,Can you help me and my daughter?,אתה יכול לעזור לי ולבת שלי?,4,Group 2,7
1501,晴,qíng,fine; clear.,עָדִין; בָּרוּר.,预报说明天天晴,yù bào shuō míng tiān tiān qíng,The forecast says it will be sunny every day,התחזית אומרת שיהיה שמש בכל יום,3,Group 2,7
1502,纸,zhǐ,paper.,נְיָר.,请给我一张纸。,Qǐng gěi wǒ yī zhāng zhǐ.,Please give me a piece of paper.,בבקשה תן לי פיסת נייר.,1,Group 2,7
1503,与,yǔ,and,ו,我与你一起去。,Wǒ yǔ nǐ yīqǐ qù.,I'll go with you.,אני אלך איתך.,2,Group 2,7
1504,地址,dìzhǐ,address.,כְּתוֹבֶת.,牌子上没有地址,pái zǐ shàng méi yǒu dì zhǐ,There is no address on the sign,אין כתובת על השלט,2,Group 2,7
1505,鼻子,bízi,nose.,אַף.,他的鼻子高高的,tā de bí zǐ gāo gāo de,His nose is high,האף שלו גבוה,2,Group 2,7
1506,练习,liànxí,practise; exercise.,לְתַרְגֵל; תַרגִיל.,他在练习弹钢琴,tā zài liàn xí dàn gāng qín,He is practicing playing the piano,הוא מתאמן בנגינה בפסנתר,2,Group 2,7
1507,英语,yīngyǔ,English,אַנגְלִית,他在讲英语故事,tā zài jiǎng yīng yǔ gù shì,He is telling an English story,הוא מספר סיפור באנגלית,2,Group 2,7
1508,伸,shēn,stretch; reach,לִמְתוֹחַ; לְהַגִיעַ,请伸出手。,Qǐng shēn chū shǒu.,Please extend your hand.,נא להושיט את ידך.,3,Group 2,5
1509,掉,diào,drop.,יְרִידָה.,东西掉了。,Dōngxi diào le.,Something fell.,משהו נפל.,2,Group 2,5
1510,开玩笑,kāiwánxiào,crack a joke; joke;,לפצח בדיחה; בְּדִיחָה;,他爱开玩笑,tā ài kāiwánxiào,He loves to joke,הוא אוהב להתבדח,3,Group 2,5
1511,忘不了,wàngbùliǎo,always remember,לזכור תמיד,我忘不了你,wǒ wàngbuliǎo nǐ,I can't forget you,אני לא יכול לשכוח אותך,3,Group 2,5
1512,小伙子,xiǎohuǒzi,lad; young fellow;,בָּחוּר; בחור צעיר;,小伙子很帅,xiǎohuǒzi hěn shuài,The boy is very handsome,הילד נאה מאוד,3,Group 2,5
1513,不得了,bùdéliǎo,extremely;,מְאוֹד;,好得不得了,hǎo de bùdéliǎo,Very good,טוב מאוד,3,Group 2,5
1514,拍,pāi,take; shoot,לִיטוֹל; לִירוֹת,请拍张照片。,Qǐng pāi zhāng zhàopiàn.,Please take a photo.,נא לצלם תמונה.,2,Group 2,6
1515,抓,zhuā,grab;,לִתְפּוֹס;,他抓了一把米,tā zhuā liǎo yī bǎ mǐ,He grabbed a handful of rice,הוא תפס חופן אורז,2,Group 2,6
1516,抽,chōu,find (time),למצוא (זמן),他抽烟太多了,tā chōu yān tài duō liǎo,He smokes too much.,הוא מעשן יותר מדי.,1,Group 2,6
1517,脸,liǎn,face;,פָּנִים;,你的脸很红。,Nǐ de liǎn hěn hóng.,Your face is very red.,הפנים שלך מאוד אדומות.,1,Group 2,6
1518,冷,lěng,cold;,קַר;,前天天气很冷,qián tiān tiān qì hěn lěng,The weather was very cold the day before yesterday,מזג האוויר היה קר מאוד שלשום,1,Group 2,6
1519,秋,qiū,autumn;,סתָיו;,秋天很凉爽。,Qiūtiān hěn liángshuǎng.,Autumn is cool.,הסתיו מגניב.,2,Group 2,6
1520,它,tā,it.,זֶה.,它闻起来好香,tā wén qǐ lái hǎo xiāng,It smells good.,זה מריח טוב.,3,Group 2,6
1521,看样子,kànyàngzi,"it seems, seem","נראה, נראה",看样子要下雨,kànyàngzi yào xiàyǔ,It looks like it's going to rain,נראה שהולך לרדת גשם,3,Group 2,6
1522,落汤鸡,luòtāngjī,soaked like drenched chicken,ספוג כמו עוף ספוג,他淋成落汤鸡,tā lín chéng luòtāngjī,He was soaked to the skin,הוא היה ספוג עד לעור,3,Group 2,6
1523,照相机,zhàoxiàngjī,camera.,מַצלֵמָה.,照相机的光圈,zhào xiāng jī de guāng quān,camera aperture,צמצם מצלמה,3,Group 2,6
1524,治,zhì,"treat, cure","לטפל, לרפא",医生治病救人,yī shēng zhì bìng jiù rén,Doctors treat illnesses and save lives,רופאים מטפלים במחלות ומצילים חיים,2,Group 2,6
1525,奖学金,jiǎngxuéjīn,scholarship;,מִלגָה;,可以得到奖学金,kě yǐ dé dào jiǎng xué jīn,Can get a scholarship,יכול לקבל מלגה,3,Group 2,7
1526,打盹儿,dǎdǔnr,doze off; take a nap.,לנמנם; לָנוּם.,我在车上打盹儿,wǒ zài chē shàng dǎdǔnr,I took a nap in the car,ישנתי תנומה באוטו,3,Group 2,7
1527,大使馆,dàshǐguǎn,embassy.,שַׁגְרִירוּת.,他在大使馆工作,tā zài dà shǐ guǎn gōng zuò,He works at the embassy,הוא עובד בשגרירות,3,Group 2,7
1528,西红柿,xīhóngshì,tomato.,עַגְבָנִיָה.,这汤里有西红柿,zhè tāng lǐ yǒu xī hóng shì,There are tomatoes in this soup,יש עגבניות במרק הזה,3,Group 2,7
1529,千,qiān,thousand;,אֶלֶף;,一千块钱不够用,yī qiān kuài qián bù gòu yòng,One thousand yuan is not enough,אלף יואן זה לא מספיק,2,Group 2,7
1530,圆,yuán,round; circular;,עִגוּל; עָגוֹל;,她的眼睛圆圆的,tā de yǎn jīng yuán yuán de,Her eyes are round,העיניים שלה עגולות,2,Group 2,7
1531,幅,fú,"(a quantifier for paintings, coplets)","(כמת לציורים, קופלטים)",墙上有一幅油画,qiáng shàng yǒu yī fú yóu huà,There is an oil painting on the wall,יש ציור שמן על הקיר,1,Group 2,7
1532,熟,shú,familiar;,מוּכָּר;,他对学术界不熟,tā duì xué shù jiè bù shú,He is unfamiliar with academia.,הוא לא מכיר את האקדמיה.,1,Group 2,7
1533,签证,qiānzhèng,visa.,וִיזָה.,需要签证。,Xūyào qiānzhèng.,Visa required.,נדרשת ויזה.,2,Group 2,5
1534,温度,wēndù,temperature.,טֶמפֶּרָטוּרָה.,温度很高。,Wēndù hěn gāo.,The temperature is very high.,הטמפרטורה גבוהה מאוד.,2,Group 2,5
1535,古迹,gǔjī,historical sites;,אתרים היסטוריים;,这是古迹。,Zhè shì gǔjì.,This is a historical site.,זהו אתר היסטורי.,2,Group 2,5
1536,零下,língxià,below zero;,מתחת לאפס;,零下五度。,Língxià wǔ dù.,Minus five degrees.,מינוס חמש מעלות.,2,Group 2,5
1537,更,gèng,"even (in a comparison), in particular","אפילו (בהשוואה), במיוחד",这个更好。,Zhège gèng hǎo.,This is better.,זה עדיף.,1,Group 2,5
1538,霜,shuāng,frost;,כְּפוֹר;,地上有霜。,Dìshang yǒu shuāng.,There is frost on the ground.,יש כפור על הקרקע.,1,Group 2,5
1539,弄,nòng,play with; do; get,לשחק עם; לַעֲשׂוֹת; לְקַבֵּל,别弄坏了。,Bié nòng huài le.,Don't break it.,אל תשבור את זה.,2,Group 2,5
1540,双,shuāng,even;,אֲפִילוּ;,这是双数。,Zhè shì shuāngshù.,This is an even number.,זהו מספר זוגי.,2,Group 2,5
1541,牌子,páizi,plate; sign; brand; trademark.,צַלַחַת; סִימָן; מותג; סִימָן מִסחָרִי.,这是名牌。,Zhè shì míngpái.,This is a famous brand.,זהו מותג מפורסם.,0,Group 2,5
1542,讲话,jiǎnghuà,"speak, talk","לדבר, לדבר",他喜欢讲话,tā xǐhuan jiǎnghuà,He likes to talk,הוא אוהב לדבר,2,Group 2,5
1543,开户,kāigù,open an account.,לפתוח חשבון.,去银行开户,qù yínháng kāigù,Go to a bank to open an account,לך לבנק כדי לפתוח חשבון,2,Group 2,5
1544,空姐,kōngjiě,stewardess,דיילת,空姐很漂亮,kōngjiě hěn piàoliang,The stewardess is very beautiful,הדיילת מאוד יפה,2,Group 2,5
1545,算卦,suànguà,tell sb.'s fortune,לספר את הונו של sb,老人会算卦,lǎorén huì suànguà,The old man can tell fortunes,הזקן יכול לספר עתידות,2,Group 2,5
1546,停留,tíngliú,stay for a time;.,להישאר לזמן מה;.,在这里停留,zài zhèlǐ tíngliú,Stay Here,הישאר כאן,2,Group 2,5
1547,同志,tóngzhì,comrade.,חָבֵר.,同志，你好,"tóngzhì, nǐ hǎo","Hello, comrade","שלום, חבר",2,Group 2,5
1548,外公,wàigōng,(maternal) grandfather.,סבא (אמהי).,外公很慈祥,wàigōng hěn cíxiáng,Grandpa is very kind,סבא מאוד אדיב,2,Group 2,5
1549,弯腰,wānyāo,bend over,לִגחוֹן,弯腰捡东西,wānyāo jiǎn dōngxi,Bending down to pick up something,מתכופף כדי להרים משהו,2,Group 2,5
1550,卫星,wèixīng,satellite;,לוויין;,卫星很先进,wèixīng hěn xiānjìn,Satellites are very advanced,לוויינים מאוד מתקדמים,2,Group 2,5
1551,摇头,yáotóu,shake one's head.,להניד את הראש.,摇头不同意,yáotóu bù tóngyì,Shake head in disagreement,נענע בראש באי הסכמה,2,Group 2,5
1552,原来,yuánlái,original; former.,מְקוֹרִי; לְשֶׁעָבַר.,原来是朋友,yuánlái shì péngyou,It turned out to be a friend,התברר שזה חבר,2,Group 2,5
1553,祖国,zǔguó,motherland;,מוֹלֶדֶת;,祖国很伟大,zǔguó hěn wěidà,The motherland is great,המולדת נהדרת,2,Group 2,5
1554,长久,chángjiǔ,"permanent, long lasting","קבוע, לאורך זמן",长久的朋友,chángjiǔ de péngyou,Long-time friends,חברים ותיקים,2,Group 2,5
1555,题目,tímù,topic,נוֹשֵׂא,题目的问题,tí mù de wèn tí,The problem with the title,הבעיה עם הכותרת,2,Group 2,5
1556,中医,zhōngyī,doctor of Chinese medicine;,דוקטור לרפואה סינית;,我看过中医,wǒ kàn guò zhōng yī,I have seen a Chinese doctor,פגשתי רופא סיני,2,Group 2,5
1557,渴,kě,thirsty;,צמא;,他渴求知识,tā kě qiú zhī shí,He thirsts for knowledge,הוא צמא לידע,1,Group 2,5
1558,少,shǎo,few; little,מְעַטִים; קְצָת,这里人很少。,Zhèlǐ rén hěn shǎo.,There are very few people here.,יש כאן מעט מאוד אנשים.,1,Group 2,6
1559,不停,bùtíng,incessantly,ללא הרף,雨不停地下。,Yǔ bùtíng de xià.,The rain keeps falling.,הגשם ממשיך לרדת.,2,Group 2,6
1560,十分,shífēn,quite.,דַי.,我十分高兴。,Wǒ shífēn gāoxìng.,I am very happy.,אני מאוד שמח.,2,Group 2,6
1561,影碟,yǐngdié,VCD,VCD,我买了影碟。,Wǒ mǎi le yǐngdié.,I bought a DVD.,קניתי DVD.,2,Group 2,6
1562,结婚,jiéhūn,marry;,לְהִתְחַתֵן;,他们结婚了。,Tāmen jiéhūn le.,They got married.,הם התחתנו.,2,Group 2,6
1563,开放,kāifàng,open,לִפְתוֹחַ,商店开放了。,Shāngdiàn kāifàng le.,The store is open.,החנות פתוחה.,2,Group 2,6
1564,语法,yǔfǎ,grammar,דִקדוּק,语法很重要。,Yǔfǎ hěn zhòngyào.,Grammar is important.,דקדוק זה חשוב.,2,Group 2,6
1565,放大,fàngdà,enlarge.,לְהַגדִיל.,请放大字体。,Qǐng fàngdà zìtǐ.,Please increase the font size.,נא להגדיל את גודל הגופן.,2,Group 2,6
1566,杯子,bēizi,cup;,גָבִיעַ;,杯子摔在地上,bēizi shuāi zài dìshàng,The cup fell to the ground,הספל נפל ארצה,2,Group 2,6
1567,拉,lā,"pull, transport","למשוך, להעביר",请拉我一把。,Qǐng lā wǒ yī bǎ.,Please give me a hand.,בבקשה תן לי יד.,1,Group 2,6
1568,偷,tōu,steal.,לִגנוֹב.,不要偷东西。,Bùyào tōu dōngxi.,Don't steal.,אל תגנוב.,2,Group 2,6
1569,药,yào,medicine,תרופה,这是你的药方,zhè shì nǐ de yào fāng,This is your prescription,זה המרשם שלך,2,Group 2,6
1570,怕,pà,fear; .,פַּחַד; .,我太怕扎针了,wǒ tài pà zā zhēn liǎo,I'm too afraid of needles.,אני מפחד מדי ממחטים.,2,Group 2,6
1571,闭,bì,close,לִסְגוֹר,"闭上你的嘴,","bì shàng nǐ de zuǐ ,","shut your mouth,","סתום את הפה שלך,",2,Group 2,6
1572,金,jīn,gold,זָהָב,这是金戒指。,Zhè shì jīn jièzhi.,This is a gold ring.,זוהי טבעת זהב.,1,Group 2,6
1573,腿,tuǐ,leg;,רֶגֶל;,我的腿很疼。,Wǒ de tuǐ hěn téng.,My legs hurt.,כואבות לי הרגליים.,2,Group 2,6
1574,烤,kǎo,bake; roast;,לֶאֱפוֹת; צָלִי;,晚餐有烤羊肉,wǎn cān yǒu kǎo yáng ròu,Dinner with roast lamb,ארוחת ערב עם כבש צלוי,2,Group 2,6
1575,加油,jiāyóu,come on!,קדימה!,加油，你能行,"jiāyóu, nǐ néng xíng","Come on, you can do it","בחייך, אתה יכול לעשות את זה",2,Group 2,6
1576,敬酒,jìngjiǔ,propose a toast; toast.,להציע טוסט; טוֹסט.,我向客人敬酒,wǒ xiàng kèrén jìngjiǔ,I toast to the guests,אני כוסית לאורחים,2,Group 2,6
1577,劳驾,láojià,excuse me.,תסלח לי.,劳驾，让一下,"láojià, ràng yīxià","Excuse me, please move aside","סליחה, בבקשה זז הצידה",2,Group 2,6
1578,签名,qiānmíng,sign one's name; autograph.,לחתום על שמו; חֲתִימָה.,请在这里签名,qǐng zài zhèlǐ qiānmíng,Please sign here,נא לחתום כאן,2,Group 2,6
1579,上街,shàngjiē,go to the street (shopping),ללכת לרחוב (קניות),妈妈上街买菜,māma shàngjiē mǎi cài,Mom goes to the street to buy vegetables,אמא הולכת לרחוב לקנות ירקות,2,Group 2,6
1580,世上,shìshang,in the world; on earth.,בעולם; עֲלֵי אֲדָמוֹת.,世上没有完美,shìshàng méiyǒu wánměi,There is no perfection in the world,אין שלמות בעולם,2,Group 2,6
1581,谈论,tánlùn,discuss; talk about.,לָדוּן; לדבר על.,他们谈论工作,tāmen tánlùn gōngzuò,They talk about work,הם מדברים על עבודה,2,Group 2,6
1582,做客,zuòkè,be a guest.,להיות אורח.,去朋友家做客,qù péngyou jiā zuòkè,Visiting a friend's house,ביקור בבית של חבר,2,Group 2,6
1583,表现,biǎoxiàn,show; display;,לְהַצִיג; לְהַצִיג;,她表现很杰出,tā biǎoxiàn hěn jiéchū,She performed outstandingly,היא הופיעה בצורה יוצאת מן הכלל,2,Group 2,6
1584,爱人,àirén,husband or wife,בעל או אישה,你有爱人吗？,nǐ yǒu ài rén má ？,Do you have a lover?,יש לך מאהב?,2,Group 2,6
1585,不如,bùrú,not equal to; not as good as;,לא שווה ל; לא טוב כמו;,弟弟不如哥哥,dì dì bù rú gē gē,The younger brother is not as good as the older brother,האח הצעיר לא טוב כמו האח הגדול,2,Group 2,6
1586,方面,fāngmiàn,respect; aspect,כִּבּוּד; אַספֶּקט,多方面的兴趣,duō fāng miàn de xīng qù,Various interests,תחומי עניין שונים,2,Group 2,6
1587,画家,huàjiā,painter; artists.,צייר; אמנים.,她是专业画家,tā shì zhuān yè huà jiā,She is a professional painter,היא ציירת מקצועית,2,Group 2,6
1588,烤鸭,kǎoyā,roast duck.,ברווז צלוי.,他很喜欢烤鸭,tā hěn xǐ huān kǎo yā,He likes roast duck very much,הוא אוהב מאוד ברווז צלוי,2,Group 2,6
1589,民歌,míngē,folk song.,שִׁיר עַם.,我还喜欢民歌,wǒ huán xǐ huān mín gē,I also like folk songs,אני גם אוהב שירי עם,2,Group 2,6
1590,身高,shēngāo,height,גוֹבַה,他身高一米八,tā shēn gāo yī mǐ bā,He is 1.8 meters tall,גובהו 1.8 מטר,2,Group 2,6
1591,这么,zhème,so; such; like this.,כָּך; כָּזֶה; כָּזֶה.,房间里这么热,fáng jiān lǐ zhè me rè,The room is so hot,החדר כל כך חם,2,Group 2,6
1592,背景,bèijǐng,background;,רֶקַע;,这是背景音乐。,Zhè shì bèijǐng yīnyuè.,This is background music.,זו מוזיקת ​​רקע.,2,Group 2,7
1593,画册,huàcè,album of paintings;,אלבום ציורים;,我有一本画册。,Wǒ yǒu yī běn huàcè.,I have a picture album.,יש לי אלבום תמונות.,2,Group 2,7
1594,包裹,bāoguǒ,package,חֲבִילָה,我收到了包裹。,Wǒ shōu dào le bāoguǒ.,I received the package.,קיבלתי את החבילה.,2,Group 2,7
1595,山水,shānshuǐ,scenery,נוֹף,山水画很漂亮。,Shānshuǐ huà hěn piàoliang.,The landscape paintings are beautiful.,ציורי הנוף יפים.,2,Group 2,7
1596,交流,jiāoliú,exchange; communicate,לְהַחלִיף; לְהַעֲבִיר,我们要多交流。,Wǒmen yào duō jiāoliú.,We need to communicate more.,אנחנו צריכים לתקשר יותר.,2,Group 2,7
1597,人口,rénkǒu,population;,אוּכְלוֹסִיָה;,中国的人口特多,zhōng guó de rén kǒu tè duō,China has a large population,בסין יש אוכלוסייה גדולה,2,Group 2,7
1598,搂,lǒu,embrace.,לְחַבֵּק.,他伸出手搂住她,tā shēn chū shǒu lǒu zhù tā,He put his arm around her,הוא כרך את זרועו סביבה,2,Group 2,7
1599,办事,bànshì,handle affairs; run an errand,לטפל בעניינים; לנהל משימה,他办事总是规矩,tā bàn shì zǒng shì guī jǔ,He always does things in a disciplined manner,הוא תמיד עושה דברים בצורה ממושמעת,2,Group 2,7
1600,不久,bùjiǔ,not long,לא ארוך,冬天不久就来了,dōng tiān bù jiǔ jiù lái liǎo,Winter is coming soon,החורף מגיע בקרוב,2,Group 2,7
1601,喘气,chuǎnqì,breathe (deeply); pant;,לנשום (עמוק); לְהִתְנַשֵׁם;,他跑完步后喘气,tā pǎo wán bù hòu chuǎnqì,He was panting after running,הוא התנשף אחרי ריצה,2,Group 2,7
1602,救命,jiùmìng,Help! (save someone's life),עֶזרָה! (להציל חיים של מישהו),救命，有人落水,"jiùmìng, yǒu rén luòshuǐ","Help, someone fell into the water","עזרה, מישהו נפל למים",2,Group 2,7
1603,大约,dàyuē,approximately;,בְּעֵרֶך;,现在大约十一点,xiàn zài dà yuē shí yī diǎn,It's about eleven o'clock now,השעה עכשיו בערך אחת עשרה,2,Group 2,7
1604,道理,dàoli,"reason, sense.","סיבה, שכל.",他说的有些道理,tā shuō de yǒu xiē dào lǐ,What he said makes some sense,יש הגיון במה שהוא אמר,2,Group 2,7
1605,国籍,guójí,nationality.,אֶזרָחוּת.,我的国籍是中国,wǒ de guó jí shì zhōng guó,My nationality is Chinese,הלאום שלי הוא סיני,2,Group 2,7
1606,开演,kāiyǎn,"(of a play, movie, etc.) begin.","(של מחזה, סרט וכו') מתחילים.",什么时候开演？,shén me shí hòu kāi yǎn ？,When does the show start?,מתי ההופעה מתחילה?,2,Group 2,7
1607,肯定,kěndìng,"be certain, sure","תהיה בטוח, בטוח",我肯定不会迷路,wǒ kěn dìng bù huì mí lù,I'm sure I won't get lost,אני בטוח שלא אלך לאיבוד,2,Group 2,7
1608,离婚,líhūn,divorce.,לְהִתְגַרֵשׁ.,他们已经离婚了,tā mén yǐ jīng lí hūn liǎo,They are divorced.,הם גרושים.,2,Group 2,7
1609,人家,rénjia,"household, family","משק בית, משפחה",人家等你半天了,rén jiā děng nǐ bàn tiān liǎo,I've been waiting for you for a long time.,אני מחכה לך הרבה זמן.,2,Group 2,7
1610,相信,xiāngxìn,believe,לְהֶאֱמִין,按摩，相信按摩,àn mó ， xiāng xìn àn mó,"Massage, believe in massage","עיסוי, מאמין בעיסוי",2,Group 2,7
1611,针灸,zhēnjiǔ,acupuncture and moxibustion.,דיקור ומוקסה.,他们还学习针灸,tā mén huán xué xí zhēn jiǔ,They also learn acupuncture,הם גם לומדים דיקור סיני,2,Group 2,7
1612,滚,gǔn,roll;,גָלִיל;,球滚走了。,Qiú gǔn zǒu le.,The ball rolled away.,הכדור התגלגל.,1,Group 2,5
1613,捎,shāo,take along/bring sth. for sb.,לקחת איתך/להביא ע''ש. עבור sb.,捎来这些花,shāo lái zhè xiē huā,Bring these flowers,תביא את הפרחים האלה,1,Group 2,5
1614,涂,tú,spread on; apply; paint,להתפשט על; לִפְנוֹת; צֶבַע,他把花涂成,tā bǎ huā tú chéng,He painted the flowers,הוא צייר את הפרחים,1,Group 2,5
1615,册,cè,volume;,כֶּרֶך;,这是第一册。,Zhè shì dì yī cè.,This is the first volume.,זהו הכרך הראשון.,1,Group 2,6
1616,刮,guā,blow (wind),לנשוף (רוח),风刮得很大。,Fēng guā de hěn dà.,The wind is blowing very hard.,הרוח נושבת חזק מאוד.,1,Group 2,6
1617,哦,ó,(an interjection),(קריאת ביניים),哦，我明白了,"ó, wǒ míngbai le","Oh, I see.","אה, אני מבין.",1,Group 2,6
1618,倍,bèi,times; -fold;,פִּי; -לְקַפֵּל;,三的三倍是九,sān de sān bèi shì jiǔ,Three times three is nine,שלוש כפול שלוש זה תשע,1,Group 2,6
1619,尝,cháng,taste; try,טַעַם; לְנַסוֹת,饼尝起来很香,bǐng cháng qǐ lái hěn xiāng,The cake tastes delicious,העוגה טעימה,1,Group 2,6
1620,阴,yīn,"cloudy, overcast","מעונן, מעונן",天开始变阴了,tiān kāi shǐ biàn yīn liǎo,The sky started to turn cloudy,השמיים החלו להיות מעוננים,1,Group 2,6
1621,双,shuāng,two; twin; both; pair;,דוּ; תְאוֹם; שְׁנֵיהֶם; זוּג;,双小提琴协奏曲,shuāng xiǎo tí qín xié zòu qū,Double Violin Concerto,קונצ'רטו לכינור כפול,1,Group 2,7
1622,除了...以外,chúle...yǐwài,except; besides;,אֶלָא; מִלְבַד;,除了他以外,chúle tā yǐwài,Except him,חוץ ממנו,0,Group 2,5
1623,一边...一边,yībiān...yībiān,"at the same time, while","בו זמנית, תוך כדי",一边走一边说,yībiān zǒu yībiān shuō,Talking while walking,מדבר תוך כדי הליכה,0,Group 2,6
1624,帮(助),bāng (zhù),help; assist;,עֶזרָה; לַעֲזוֹר;,我们互相帮助,wǒmen hùxiāng bāngzhù,We help each other,אנחנו עוזרים אחד לשני,0,Group 2,6
1625,只要...就,zhǐyào...jiù,as long as...(will)...,כל עוד...(יעשה)...,只要努力就成功,zhǐyào nǔlì jiù chénggōng,"As long as you work hard, you will succeed","כל עוד אתה עובד קשה, אתה תצליח",0,Group 2,7
1626,一...就...,yī...jiù...,once...so,פעם אחת... אז,我一回家就吃饭,wǒ yī huí jiā jiù chī fàn,I eat as soon as I get home,אני אוכל ברגע שאני מגיע הביתה,0,Group 2,7
