line number,Character,Character pinyin,Character EN translation,Character HE translation ,Related Sentence,Sentence Pinyin,Sentence EN Translation,Sentence HE Translation,Apearances in sentences,Group,Sentence Length
939,顶,dǐng,top,רֹאשׁ,山顶风景很美,shān dǐng fēng jǐng hěn měi,The scenery at the top of the mountain is beautiful,הנוף בראש ההר יפהפה,2,Group 1,6
940,颜,yán,Yan,יאן,她的颜值很高,tā de yán zhí hěn gāo,She is very beautiful,היא מאוד יפה,2,Group 1,6
941,风,fēng,wind,רוּחַ,春风吹过湖面,chūn fēng chuī guò hú miàn,Spring breeze blows across the lake,רוח אביבית נושבת על פני האגם,13,Group 1,6
942,驾,jià,drive,לִנְהוֹג,他学会了驾车,tā xué huì liǎo jià chē,He learned to drive,הוא למד לנהוג,2,Group 1,6
943,鱼,yú,fish,לָדוּג,河里有很多鱼,hé lǐ yǒu hěn duō yú,There are many fish in the river,יש הרבה דגים בנהר,2,Group 1,6
944,鲜,xiān,fresh,טָרִי,水果非常新鲜,shuǐ guǒ fēi cháng xīn xiān,The fruit is very fresh,הפרי טרי מאוד,7,Group 1,6
945,鼻,bí,nose,אַף,她的鼻子很挺,tā de bí zǐ hěn tǐng,Her nose is very straight,האף שלה מאוד ישר,2,Group 1,6
946,丝,sī,Silk,מֶשִׁי,她的头发细如丝,tā de tóu fā xì rú sī,Her hair is as fine as silk,השיער שלה עדין כמו משי,1,Group 1,7
947,何,hé,what,מַה,你为何迟到了？,nǐ wéi hé chí dào liǎo ？,Why are you late?,למה אתה מאחר?,5,Group 1,7
948,候,hòu,Hou,הו,等候区有许多人,děng hòu qū yǒu xǔ duō rén,There are many people in the waiting area,יש הרבה אנשים באזור ההמתנה,6,Group 1,7
949,元,yuán,Yuan,יוּאָן,这张票价值五元,zhè zhāng piào jià zhí wǔ yuán,This ticket is worth five yuan.,כרטיס זה שווה חמישה יואן.,3,Group 1,7
950,卧,wò,Lying,שֶׁקֶר,他卧在床上休息,tā wò zài chuáng shàng xiū xī,He rested in bed,הוא נח במיטה,1,Group 1,7
951,呢,ne,Woolen cloth,בד צמר,你在做什么呢？,nǐ zài zuò shén me ne ？,What are you doing?,מה אתה עושה?,6,Group 1,7
952,哎,āi,Why,מַדוּעַ,哎，他又迟到了,āi ， tā yòu chí dào liǎo,"Oh, he's late again.","הו, הוא שוב מאחר.",4,Group 1,7
953,土,tǔ,earth,כַּדוּר הָאָרֶץ,农民在田里翻土,nóng mín zài tián lǐ fān tǔ,Farmers turning the soil in the fields,חקלאים הופכים את האדמה בשדות,2,Group 1,7
954,堂,táng,Hall,אוּלָם,礼堂里座无虚席,lǐ táng lǐ zuò wú xū xí,The auditorium was packed,האודיטוריום היה עמוס,2,Group 1,7
955,夫,fū,husband,בַּעַל,他是一个好丈夫,tā shì yī gè hǎo zhàng fū,He is a good husband.,הוא בעל טוב.,3,Group 1,7
956,姓,xìng,surname,שֵׁם מִשׁפָּחָה,你的姓是什么？,nǐ de xìng shì shén me ？,What's your surname?,מה שם המשפחה שלך?,2,Group 1,7
957,尊,zūn,Zun,זון,我们要尊重长辈,wǒ mén yào zūn zhòng cháng bèi,We must respect our elders,עלינו לכבד את הזקנים שלנו,1,Group 1,7
958,延,yán,Extension,הַרחָבָה,我们延长了假期,wǒ mén yán cháng liǎo jiǎ qī,We extended our vacation,הארכנו את החופשה,2,Group 1,7
959,恐,kǒng,fear,פַּחַד,他对蛇感到恐惧,tā duì shé gǎn dào kǒng jù,He is afraid of snakes,הוא מפחד מנחשים,2,Group 1,7
960,扎,zhā,tie,עֲנִיבָה,医生小心地扎针,yī shēng xiǎo xīn dì zā zhēn,The doctor carefully inserted the needle,הרופא הכניס את המחט בזהירות,4,Group 1,7
961,敬,jìng,respect,כִּבּוּד,我们要敬老爱幼,wǒ mén yào jìng lǎo ài yòu,We should respect the elderly and love the young,אנחנו צריכים לכבד את הקשישים ולאהוב את הצעירים,2,Group 1,7
962,未,wèi,not yet,טֶרֶם,他还未完成作业,tā huán wèi wán chéng zuò yè,He hasn't finished his homework yet,הוא עדיין לא סיים את שיעורי הבית שלו,4,Group 1,7
963,植,zhí,plant,לִשְׁתוֹל,农民在田里植树,nóng mín zài tián lǐ zhí shù,Farmers planting trees in the fields,חקלאים נוטעים עצים בשדות,1,Group 1,7
964,概,gài,Overview,סקירה כללית,大概明天会下雨,dà gài míng tiān huì xià yǔ,It will probably rain tomorrow,כנראה יירד גשם מחר,4,Group 1,7
965,没,méi,without,לְלֹא,我昨天没去上课,wǒ zuó tiān méi qù shàng kè,I didn't go to class yesterday,לא הלכתי לשיעור אתמול,23,Group 1,7
966,洗,xǐ,wash,לִשְׁטוֹף,每天早上要洗脸,měi tiān zǎo shàng yào xǐ liǎn,Wash your face every morning,שטפו את הפנים כל בוקר,3,Group 1,7
967,消,xiāo,remove,לְהַסִיר,她正在消化晚饭,tā zhèng zài xiāo huà wǎn fàn,She is digesting dinner.,היא מעכלת ארוחת ערב.,3,Group 1,7
968,港,gǎng,port,נָמָל,港口停满了货船,gǎng kǒu tíng mǎn liǎo huò chuán,The port is full of cargo ships,הנמל מלא בספינות משא,3,Group 1,7
969,漆,qī,paint,צֶבַע,墙上刷了白色漆,qiáng shàng shuā liǎo bái sè qī,The walls were painted white,הקירות נצבעו בלבן,4,Group 1,7
970,牌,pái,Card,כַּרְטִיס,桌上摆着扑克牌,zhuō shàng bǎi zhuó pū kè pái,Poker cards on the table,קלפי פוקר על השולחן,3,Group 1,7
971,牛,niú,ox,שׁוֹר,农田里有几头牛,nóng tián lǐ yǒu jī tóu niú,There are several cows in the farmland,יש כמה פרות בשטח החקלאי,2,Group 1,7
972,球,qiú,ball,כַּדוּר,他在操场上踢球,tā zài cāo cháng shàng tī qiú,He is playing football on the playground,הוא משחק כדורגל במגרש המשחקים,2,Group 1,7
973,瓷,cí,porcelain,חַרְסִינָה,这只瓷杯很精致,zhè zhī cí bēi hěn jīng zhì,This porcelain cup is very exquisite,כוס החרסינה הזו מאוד מעודנת,1,Group 1,7
974,眼,yǎn,Eye,עַיִן,她的眼睛很明亮,tā de yǎn jīng hěn míng liàng,Her eyes are bright,העיניים שלה בוהקות,2,Group 1,7
975,短,duǎn,short,קָצָר,这篇文章有点短,zhè piān wén zhāng yǒu diǎn duǎn,This article is a bit short,המאמר הזה קצת קצר,2,Group 1,7
976,础,chǔ,foundation,קֶרֶן,打好基础很重要,dǎ hǎo jī chǔ hěn zhòng yào,It is important to lay a solid foundation,חשוב להניח בסיס איתן,1,Group 1,7
977,硬,yìng,hard,קָשֶׁה,这块石头非常硬,zhè kuài shí tóu fēi cháng yìng,This stone is very hard.,האבן הזו קשה מאוד.,1,Group 1,7
978,筑,zhù,build,לִבנוֹת,工人们正在筑桥,gōng rén mén zhèng zài zhù qiáo,Workers are building a bridge,עובדים בונים גשר,2,Group 1,7
979,练,liàn,practice,לְתַרְגֵל,他每天练习书法,tā měi tiān liàn xí shū fǎ,He practices calligraphy every day,הוא מתאמן בקליגרפיה כל יום,4,Group 1,7
980,羊,yáng,sheep,כִּבשָׂה,农场里有很多羊,nóng cháng lǐ yǒu hěn duō yáng,There are many sheep on the farm,יש הרבה כבשים בחווה,2,Group 1,7
981,而,ér,and,ו,他勤奋而又谦虚,tā qín fèn ér yòu qiān xū,He is hardworking and humble,הוא חרוץ וצנוע,4,Group 1,7
982,肯,kěn,Ken,קן,他肯帮忙做家务,tā kěn bāng máng zuò jiā wù,He is willing to help with housework,הוא מוכן לעזור בעבודות הבית,2,Group 1,7
983,腰,yāo,waist,מוֹתֶן,他腰疼需要休息,tā yāo téng xū yào xiū xī,He has a backache and needs to rest.,יש לו כאבי גב והוא צריך לנוח.,3,Group 1,7
984,葫,hú,gourd,דְלַעַת,葫芦里盛着清水,hú lú lǐ shèng zhuó qīng shuǐ,The gourd is filled with clear water,הדלעת מלאה במים צלולים,3,Group 1,7
985,薯,shǔ,Yam,בַּטָטָה,我买了一些红薯,wǒ mǎi liǎo yī xiē hóng shǔ,I bought some sweet potatoes,קניתי כמה בטטות,2,Group 1,7
986,蜡,là,wax,דוֹנַג,蜡烛在夜晚闪烁,là zhú zài yè wǎn shǎn shuò,candles flickering in the night,נרות מהבהבים בלילה,1,Group 1,7
987,裤,kù,pants,מִכְנָסַיִים,他换上了运动裤,tā huàn shàng liǎo yùn dòng kù,He changed into sweatpants,הוא החליף מכנסי טרנינג,3,Group 1,7
988,觉,jué,Sleep,לִישׁוֹן,我感觉今天很累,wǒ gǎn jué jīn tiān hěn léi,I feel very tired today,אני מרגיש מאוד עייף היום,5,Group 1,7
989,访,fǎng,visit,לְבַקֵר,他去拜访了朋友,tā qù bài fǎng liǎo péng yǒu,He went to visit a friend,הוא הלך לבקר חבר,4,Group 1,7
990,语,yǔ,language,שָׂפָה,他精通多国语言,tā jīng tōng duō guó yǔ yán,He is fluent in multiple languages,הוא שולט במספר שפות,6,Group 1,7
991,说,shuō,explain,לְהַסבִּיר,老师说得很清楚,lǎo shī shuō dé hěn qīng chǔ,The teacher explained it very clearly,המורה הסבירה את זה בצורה מאוד ברורה,24,Group 1,7
992,课,kè,class,מַחלָקָה,今天的课很有趣,jīn tiān de kè hěn yǒu qù,Today's class is very interesting,השיעור היום מאוד מעניין,7,Group 1,7
993,谅,liàng,forgive,לִסְלוֹחַ,请谅解我的失误,qǐng liàng jiě wǒ de shī wù,Please forgive my mistake,אנא סלח לי על טעותי,2,Group 1,7
994,贵,guì,expensive,יָקָר,这块手表非常贵,zhè kuài shǒu biǎo fēi cháng guì,This watch is very expensive.,השעון הזה מאוד יקר.,5,Group 1,7
995,距,jù,distance,מֶרְחָק,学校距离家很近,xué xiào jù lí jiā hěn jìn,The school is very close to home,בית הספר קרוב מאוד לבית,2,Group 1,7
996,辛,xīn,pungent,חָרִיף,他工作非常辛苦,tā gōng zuò fēi cháng xīn kǔ,He works very hard.,הוא עובד קשה מאוד.,2,Group 1,7
997,运,yùn,transport,תַחְבּוּרָה,今天的运气很好,jīn tiān de yùn qì hěn hǎo,Good luck today,בהצלחה היום,3,Group 1,7
998,连,lián,even,אֲפִילוּ,他连忙赶来帮忙,tā lián máng gǎn lái bāng máng,He rushed to help,הוא מיהר לעזור,2,Group 1,7
999,野,yě,wild,פְּרָאִי,野花开满了山坡,yě huā kāi mǎn liǎo shān pō,Wild flowers bloomed all over the hillside,פרחי בר פרחו בכל צלע הגבעה,2,Group 1,7
1000,铁,tiě,iron,בַּרזֶל,铁桥结实又耐用,tiě qiáo jié shí yòu nài yòng,The iron bridge is strong and durable,גשר הברזל חזק ועמיד,4,Group 1,7
1001,随,suí,Follow,לַעֲקוֹב,他随身带着护照,tā suí shēn dài zhuó hù zhào,He carries his passport with him,הוא נושא עמו את הדרכון שלו,1,Group 1,7
1002,集,jí,set,מַעֲרֶכֶת,我们去集市买菜,wǒ mén qù jí shì mǎi cài,Let's go to the market to buy vegetables,בוא נלך לשוק לקנות ירקות,6,Group 1,7
1003,零,líng,zero,אֶפֶס,零钱放在抽屉里,líng qián fàng zài chōu tì lǐ,Put the change in the drawer,שים את השינוי במגירה,3,Group 1,7
1004,鞋,xié,shoe,נַעַל,新买的鞋很舒服,xīn mǎi de xié hěn shū fú,The new shoes I bought are very comfortable,הנעליים החדשות שקניתי מאוד נוחות,2,Group 1,7
1005,音,yīn,sound,קוֹל,音乐声让人放松,yīn lè shēng ràng rén fàng sōng,The sound of music makes people relax,צליל המוזיקה גורם לאנשים להירגע,4,Group 1,7
1006,马,mǎ,horse,סוּס,农场里有几匹马,nóng cháng lǐ yǒu jī pǐ mǎ,There are several horses on the farm,יש כמה סוסים בחווה,9,Group 1,7
1007,骑,qí,ride,לִרְכּוֹב,我喜欢骑自行车,wǒ xǐ huān qí zì xíng chē,I like riding a bicycle,אני אוהב לרכוב על אופניים,2,Group 1,7
1008,骨,gǔ,bone,עֶצֶם,骨头汤很有营养,gǔ tóu tāng hěn yǒu yíng yǎng,Bone broth is very nutritious,מרק עצמות מזין מאוד,2,Group 1,7
1009,鸡,jī,chicken,עוֹף,早餐我吃了鸡蛋,zǎo cān wǒ chī liǎo jī dàn,I had eggs for breakfast,אכלתי ביצים לארוחת בוקר,2,Group 1,7
1010,鸭,yā,duck,לְהִתְכּוֹפֵף,池塘里有几只鸭,chí táng lǐ yǒu jī zhī yā,There are a few ducks in the pond,יש כמה ברווזים בבריכה,2,Group 1,7
1011,麦,mài,wheat,חיטה,农田里种了麦子,nóng tián lǐ zhǒng liǎo mài zǐ,Wheat is planted in the fields,חיטה נטועה בשדות,2,Group 1,7
1012,黄,huáng,yellow,צָהוֹב,黄叶飘落在地上,huáng yè piāo luò zài dì shàng,Yellow leaves falling on the ground,עלים צהובים נושרים על האדמה,3,Group 1,7
1013,九,jiǔ,Nine,תֵשַׁע,他九点钟准时到达,tā jiǔ diǎn zhōng zhǔn shí dào dá,He arrived on time at nine o'clock,הוא הגיע בזמן בשעה תשע,3,Group 1,8
1014,乡,xiāng,Township,עֲיָרָה,我的家乡风景如画,wǒ de jiā xiāng fēng jǐng rú huà,My hometown is picturesque,עיר הולדתי ציורית,3,Group 1,8
1015,似,sì,like,כְּמוֹ,他似乎有些不开心,tā sì hū yǒu xiē bù kāi xīn,He seems a little unhappy,הוא נראה קצת לא מרוצה,2,Group 1,8
1016,半,bàn,Half,חֲצִי,我们等了半个小时,wǒ mén děng liǎo bàn gè xiǎo shí,We waited for half an hour,חיכינו חצי שעה,5,Group 1,8
1017,南,nán,South,דָרוֹם,他家在城市的南边,tā jiā zài chéng shì de nán biān,His home is in the south of the city,ביתו נמצא בדרום העיר,2,Group 1,8
1018,危,wēi,Danger,סַכָּנָה,高空作业非常危险,gāo kōng zuò yè fēi cháng wēi xiǎn,Working at heights is very dangerous,עבודה בגובה מסוכנת מאוד,1,Group 1,8
1019,即,jí,Right now,ממש עכשיו,他即将出发去北京,tā jí jiāng chū fā qù běi jīng,He is about to leave for Beijing,הוא עומד לעזוב לבייג'ינג,2,Group 1,8
1020,右,yòu,right,יָמִינָה,右边的房间有人住,yòu biān de fáng jiān yǒu rén zhù,The room on the right is occupied.,החדר מימין תפוס.,5,Group 1,8
1021,咱,zán,we,אָנוּ,咱们一起去看电影,zán mén yī qǐ qù kàn diàn yǐng,Let's go to the movies together,בואו נלך יחד לקולנוע,2,Group 1,8
1022,喘,chuǎn,asthma,אַסְתְמָה,他跑步后气喘吁吁,tā pǎo bù hòu qì chuǎn xū xū,He was out of breath after running,הוא היה חסר נשימה לאחר ריצה,2,Group 1,8
1023,嘴,zuǐ,Mouth,פֶּה,请把食物放进嘴里,qǐng bǎ shí wù fàng jìn zuǐ lǐ,Please put the food in your mouth,נא להכניס את האוכל לפה,3,Group 1,8
1024,妻,qī,wife,אִשָׁה,他和妻子一起旅行,tā hé qī zǐ yī qǐ lǚ xíng,He traveled with his wife,הוא נסע עם אשתו,4,Group 1,8
1025,宾,bīn,Guest,אוֹרֵחַ,宾馆的服务很周到,bīn guǎn de fú wù hěn zhōu dào,The hotel's service is very thoughtful,השירות של המלון מאוד מתחשב,1,Group 1,8
1026,寒,hán,cold,קַר,冬天的寒风很刺骨,dōng tiān de hán fēng hěn cì gǔ,The winter wind is biting,רוח החורף נושכת,3,Group 1,8
1027,将,jiāng,Will,רָצוֹן,他将书放在桌子上,tā jiāng shū fàng zài zhuō zǐ shàng,He put the book on the table,הוא הניח את הספר על השולחן,4,Group 1,8
1028,尽,jìn,Do,לַעֲשׂוֹת,他尽力完成了任务,tā jìn lì wán chéng liǎo rèn wù,He tried his best to complete the task,הוא ניסה כמיטב יכולתו להשלים את המשימה,1,Group 1,8
1029,岛,dǎo,island,אִי,这个小岛风景优美,zhè gè xiǎo dǎo fēng jǐng yōu měi,This island has beautiful scenery,באי הזה יש נוף יפהפה,1,Group 1,8
1030,差,chà,Difference,הֶבדֵל,今天的成绩差了点,jīn tiān de chéng jì chà liǎo diǎn,Today's results were a bit off.,התוצאות של היום היו קצת לא טובות.,3,Group 1,8
1031,币,bì,currency,מַטְבֵּעַ,银行可以兑换外币,yín xíng kě yǐ duì huàn wài bì,Banks can exchange foreign currency,בנקים יכולים להחליף מטבע חוץ,1,Group 1,8
1032,希,xī,hope,לְקַווֹת,希望明天天气晴朗,xī wàng míng tiān tiān qì qíng lǎng,I hope it will be sunny tomorrow,אני מקווה שמחר יהיה שמש,5,Group 1,8
1033,态,tài,state,מְדִינָה,他的态度非常认真,tā de tài dù fēi cháng rèn zhēn,He's very serious about it.,הוא מאוד רציני לגבי זה.,1,Group 1,8
1034,思,sī,think,לַחשׁוֹב,他在思考这个问题,tā zài sī kǎo zhè gè wèn tí,He is thinking about this problem,הוא חושב על הבעיה הזו,2,Group 1,8
1035,托,tuō,Trust,אֵמוּן,请托朋友帮忙搬家,qǐng tuō péng yǒu bāng máng bān jiā,Ask friends to help with moving,בקשו מחברים לעזור במעבר,1,Group 1,8
1036,折,zhé,fold,לְקַפֵּל,我不小心把纸折了,wǒ bù xiǎo xīn bǎ zhǐ zhē liǎo,I accidentally folded the paper,קיפלתי בטעות את הנייר,1,Group 1,8
1037,担,dān,burden,עוֹל,他担心明天的考试,tā dān xīn míng tiān de kǎo shì,He is worried about tomorrow's test,הוא מודאג לגבי המבחן של מחר,3,Group 1,8
1038,替,tì,for,עֲבוּר,他替我完成了作业,tā tì wǒ wán chéng liǎo zuò yè,He completed the homework for me,הוא השלים לי את שיעורי הבית,1,Group 1,8
1039,机,jī,machine,מְכוֹנָה,飞机在天空中飞行,fēi jī zài tiān kōng zhōng fēi xíng,Airplane flying in the sky,מטוס טס בשמיים,12,Group 1,8
1040,柜,guì,cabinet,אָרוֹן,衣柜里挂满了衣服,yī guì lǐ guà mǎn liǎo yī fú,The closet is full of clothes,הארון מלא בבגדים,1,Group 1,8
1041,检,jiǎn,Inspection,בְּדִיקָה,他检验了实验结果,tā jiǎn yàn liǎo shí yàn jié guǒ,He checked the experimental results,הוא בדק את תוצאות הניסוי,1,Group 1,8
1042,歉,qiàn,apologize,לְהִתְנַצֵל,对不起，我很歉意,duì bù qǐ ， wǒ hěn qiàn yì,I'm sorry. I'm sorry.,אני מצטער. אני מצטער.,2,Group 1,8
1043,求,qiú,beg,לְהִתְחַנֵן,他向老师求教问题,tā xiàng lǎo shī qiú jiào wèn tí,He asked the teacher for advice,הוא ביקש עצה מהמורה,3,Group 1,8
1044,油,yóu,Oil,שֶׁמֶן,炒菜要加适量的油,chǎo cài yào jiā shì liáng de yóu,Add appropriate amount of oil when cooking,הוסף כמות מתאימה של שמן בעת ​​הבישול,7,Group 1,8
1045,湿,shī,wet,רָטוֹב,地面湿滑，要小心,dì miàn shī huá ， yào xiǎo xīn,"The ground is slippery, be careful","הקרקע חלקה, היזהר",3,Group 1,8
1046,滨,bīn,coast,חוֹף,我们沿着滨江散步,wǒ mén yán zhuó bīn jiāng sàn bù,We took a walk along the riverside,טיילנו לאורך שפת הנהר,2,Group 1,8
1047,烟,yān,cigarette,סִיגַרִיָה,烟雾弥漫在空气中,yān wù mí màn zài kōng qì zhōng,Smoke fills the air,עשן ממלא את האוויר,5,Group 1,8
1048,熊,xióng,Bear,דוֹב,森林里有一只大熊,sēn lín lǐ yǒu yī zhī dà xióng,There is a big bear in the forest,יש דוב גדול ביער,3,Group 1,8
1049,玩,wán,Play,לְשַׂחֵק,孩子们在公园玩耍,hái zǐ mén zài gōng yuán wán shuǎ,Children playing in the park,ילדים משחקים בפארק,3,Group 1,8
1050,珍,zhēn,Jane,ג'יין,珍珠项链非常漂亮,zhēn zhū xiàng liàn fēi cháng piāo liàng,The pearl necklace is very beautiful,שרשרת הפנינים מאוד יפה,2,Group 1,8
1051,瓜,guā,melon,מֵלוֹן,夏天吃西瓜很解渴,xià tiān chī xī guā hěn jiě kě,Eating watermelon in summer is very thirst-quenching,אכילת אבטיח בקיץ מרווה מאוד צימאון,3,Group 1,8
1052,瓶,píng,bottle,בַּקבּוּק,桌上放着一个花瓶,zhuō shàng fàng zhuó yī gè huā píng,There is a vase on the table,יש אגרטל על השולחן,2,Group 1,8
1053,由,yóu,Depend on,תלוי ב,由他来决定去哪里,yóu tā lái jué dìng qù nǎ lǐ,It's up to him to decide where to go.,זה תלוי בו להחליט לאן ללכת.,4,Group 1,8
1054,码,mǎ,code,קוד,请扫描二维码付款,qǐng sǎo miáo èr wéi mǎ fù kuǎn,Please scan the QR code to pay,אנא סרוק את קוד ה-QR כדי לשלם,2,Group 1,8
1055,硕,shuò,large,גָדוֹל,他获得了硕士学位,tā huò dé liǎo shuò shì xué wèi,He received his master's degree,הוא קיבל את התואר השני שלו,1,Group 1,8
1056,碟,dié,dish,צַלַחַת,我买了一张音乐碟,wǒ mǎi liǎo yī zhāng yīn lè dié,I bought a music CD,קניתי דיסק מוזיקה,3,Group 1,8
1057,福,fú,blessing,בְּרָכָה,祝大家幸福与平安,zhù dà jiā xìng fú yǔ píng ān,I wish you all happiness and peace,אני מאחל לכולכם אושר ושלווה,2,Group 1,8
1058,租,zū,rent,לִשְׂכּוֹר,我打算租一间公寓,wǒ dǎ suàn zū yī jiān gōng yù,I plan to rent an apartment,אני מתכנן לשכור דירה,1,Group 1,8
1059,突,tū,sudden,פִּתְאוֹמִי,他突然出现在门口,tā tū rán chū xiàn zài mén kǒu,He suddenly appeared at the door,הוא הופיע לפתע בדלת,1,Group 1,8
1060,笃,dǔ,Du,דו,他笃信自己的理想,tā dǔ xìn zì jǐ de lǐ xiǎng,He believed in his ideals,הוא האמין באידיאלים שלו,2,Group 1,8
1061,筒,tǒng,cylinder,צִילִינדֶר,纸筒里装满了海报,zhǐ tǒng lǐ zhuāng mǎn liǎo hǎi bào,The paper tube is filled with posters,צינור הנייר מלא בפוסטרים,1,Group 1,8
1062,筷,kuài,chopsticks,מַקלוֹת אֲכִילָה,用筷子吃饭很方便,yòng kuài zǐ chī fàn hěn fāng biàn,It is convenient to eat with chopsticks,נוח לאכול עם מקלות אכילה,1,Group 1,8
1063,简,jiǎn,simple,פָּשׁוּט,说明书写得很简明,shuō míng shū xiě dé hěn jiǎn míng,The instructions are very concise,ההוראות מאוד תמציתיות,5,Group 1,8
1064,约,yuē,about,אוֹדוֹת,我们约好明天见面,wǒ mén yuē hǎo míng tiān jiàn miàn,We agreed to meet tomorrow,סיכמנו להיפגש מחר,2,Group 1,8
1065,续,xù,Continued,נִמשָׁך,我们需要续订合同,wǒ mén xū yào xù dìng hé tóng,We need to renew the contract,אנחנו צריכים לחדש את החוזה,2,Group 1,8
1066,缆,lǎn,cable,כֶּבֶל,索道的缆绳很结实,suǒ dào de lǎn shéng hěn jié shí,The cable of the ropeway is very strong,הכבל של החבל חזק מאוד,1,Group 1,8
1067,翻,fān,turn,פִּנָה,他翻开了新的一页,tā fān kāi liǎo xīn de yī yè,He turned over a new leaf,הוא הפך דף חדש,2,Group 1,8
1068,肉,ròu,Meat,בָּשָׂר,我们买了新鲜的肉,wǒ mén mǎi liǎo xīn xiān de ròu,We bought fresh meat,קנינו בשר טרי,3,Group 1,8
1069,肚,dù,Belly,בֶּטֶן,他肚子饿得咕咕叫,tā dù zǐ è dé gū gū jiào,His stomach growled with hunger.,בטנו נהמה מרעב.,2,Group 1,8
1070,般,bān,General,כְּלָלִי,他像父亲般关心我,tā xiàng fù qīn bān guān xīn wǒ,He cares about me like a father.,הוא דואג לי כמו אבא.,2,Group 1,8
1071,草,cǎo,Grass,דֶשֶׁא,草地上开满了野花,cǎo dì shàng kāi mǎn liǎo yě huā,The meadow is full of wildflowers,האחו מלא בפרחי בר,3,Group 1,8
1072,虎,hǔ,Tiger,נָמֵר,森林里有一只老虎,sēn lín lǐ yǒu yī zhī lǎo hǔ,There is a tiger in the forest,יש נמר ביער,5,Group 1,8
1073,衫,shān,shirt,חוּלצָה,她买了一件新衬衫,tā mǎi liǎo yī jiàn xīn chèn shān,She bought a new shirt,היא קנתה חולצה חדשה,1,Group 1,8
1074,裙,qún,skirt,חֲצָאִית,她穿着漂亮的裙子,tā chuān zhuó piāo liàng de qún zǐ,She is wearing a beautiful dress,היא לובשת שמלה יפה,1,Group 1,8
1075,计,jì,count,לִסְפּוֹר,他认真计算了总价,tā rèn zhēn jì suàn liǎo zǒng jià,He carefully calculated the total price,הוא חישב בקפידה את המחיר הכולל,5,Group 1,8
1076,许,xǔ,May,מַאִי,他许下了一个愿望,tā xǔ xià liǎo yī gè yuàn wàng,He made a wish,הוא הביע משאלה,7,Group 1,8
1077,识,shí,knowledge,יֶדַע,认识新朋友很有趣,rèn shí xīn péng yǒu hěn yǒu qù,It's fun to meet new people,כיף להכיר אנשים חדשים,4,Group 1,8
1078,谁,shéi,who,WHO,谁能告诉我答案？,shuí néng gào sù wǒ dá àn ？,Who can tell me the answer?,מי יכול להגיד לי את התשובה?,1,Group 1,8
1079,谎,huǎng,lie,שֶׁקֶר,他告诉了一个小谎,tā gào sù liǎo yī gè xiǎo huǎng,He told a little lie,הוא סיפר שקר קטן,5,Group 1,8
1080,豆,dòu,bean,שְׁעוּעִית,我们买了一袋黄豆,wǒ mén mǎi liǎo yī dài huáng dòu,We bought a bag of soybeans.,קנינו שקית פולי סויה.,2,Group 1,8
1081,跤,jiāo,wrestle,לְהִתגוֹשֵׁשׁ,他不小心摔了一跤,tā bù xiǎo xīn shuāi liǎo yī jiāo,He accidentally fell,הוא נפל בטעות,1,Group 1,8
